{
  "code": "sw",
  "name": "Swahili",
  "native_name": "Kiswahili",
  "cap_feed_url": "https://www.ethiomet.gov.et/api/cap/rss.xml",
  "fallback_cap_feed_url": "https://severeweather.wmo.int/v2/cap-alerts/et-emi-en/rss.xml",
  "cap_sender_id": "emi@ethiomet.gov.et",
  "translations": {
    "Settings": "Mipangilio",
    "settings.alwaysShowStartPage": "Onyesha Ukurasa wa Kuanza Kila Wakati",
    "settings.alwaysShowStartPage.description": "Onyesha skrini ya karibu kila unapofungua programu.",
    "settings.appearance": "Mwonekano",
    "settings.appearance.description": "Chagua jinsi programu inavyoonekana, au ilingane na mpangilio wa kifaa chako.",
    "settings.appearance.system": "Mfumo",
    "settings.appearance.light": "Mwanga",
    "settings.appearance.dark": "Giza",
    "Retry": "Jaribu tena",
    "forecast.error.title": "Imeshindwa kupakia utabiri",
    "warnings.error.title": "Imeshindwa kupakia tahadhari",
    "location.notSet.title": "Hakuna mahali palipowekwa",
    "location.notSet.text": "Chagua mahali ili kuona utabiri na tahadhari zake.",
    "location.notSet.action": "Chagua mahali",
    "About us": "Kuhusu sisi",
    "About the app": "Kuhusu programu",
    "Privacy Policy": "Sera ya Faragha",
    "privacy.intro": "Climweb Weather App imetengenezwa na WMO-RAF (Ofisi ya Kanda ya Shirika la Hali ya Hewa Duniani kwa Afrika) na Norway MET (Meteorologisk institutt). Tumejitolea kulinda faragha yako.",
    "privacy.dataCollected.title": "Taarifa Tunazokusanya",
    "privacy.dataCollected.text": "Climweb Weather App haikusanyi, kuhifadhi, au kushiriki taarifa zako binafsi. Hauhitaji kujisajili au kutoa maelezo yoyote binafsi ili kutumia programu hii.",
    "privacy.location.title": "Matumizi ya Data ya Mahali",
    "privacy.location.text": "Ili kukuonyesha utabiri sahihi wa hali ya hewa na tahadhari kwa eneo lako, programu hutumia mahali pa kifaa chako. Mahali pako panatumika tu kupata data ya hali ya hewa kwa eneo hilo na hapaunganishwi na utambulisho wako wala kuhifadhiwa kwenye seva zetu.",
    "privacy.favourites.title": "Maeneo Yako Uyapendayo",
    "privacy.favourites.text": "Ukihifadhi maeneo unayoyapenda, yanahifadhiwa kwenye kifaa chako pekee. Taarifa hii haitumwi kwetu wala kushirikiwa na mtu mwingine yeyote. Unaweza kuongeza, kubadilisha, au kuondoa maeneo yako uyapendayo wakati wowote kutoka kwenye kichupo cha Maeneo.",
    "privacy.security.title": "Usalama wa Data",
    "privacy.security.text": "Tunachukulia usalama wa data kwa uzito. Kwa kuwa hatukusanyi wala kuhifadhi data binafsi, lengo letu ni kuhakikisha huduma za utabiri na tahadhari za programu ni sahihi na za kuaminika.",
    "privacy.children.title": "Faragha ya Watoto",
    "privacy.children.text": "Climweb Weather App imeundwa kutumiwa na watu wa umri wote, ikiwemo watoto. Hatukusanyi taarifa binafsi kutoka kwa watoto au watumiaji wengine wowote.",
    "privacy.thirdParty.title": "Huduma za Wahusika Wengine",
    "privacy.thirdParty.text": "Programu hii inaweza kuwa na viungo vya tovuti au huduma za wahusika wengine tusizozisimamia. Ukigusa kiungo cha mhusika mwingine, utapelekwa kwenye tovuti ya mhusika huyo. Tunakushauri kusoma sera zao za faragha, kwani hatuwajibiki kwa maudhui au taratibu zao.",
    "privacy.changes.title": "Mabadiliko ya Sera Hii",
    "privacy.changes.text": "Tunaweza kusasisha Sera hii ya Faragha mara kwa mara. Mabadiliko yoyote yataonyeshwa kwenye ukurasa huu.",
    "privacy.contact.title": "Wasiliana Nasi",
    "privacy.contact.text": "Ikiwa una maswali kuhusu Sera hii ya Faragha, tafadhali wasiliana na WMO-RAF (Ofisi ya Kanda ya Shirika la Hali ya Hewa Duniani kwa Afrika) au Norway MET (Meteorologisk institutt).",
    "Today": "Leo",
    "5 days": "Siku 5",
    "Warnings": "Tahadhari",
    "Alerts": "Tahadhari",
    "Places": "Maeneo",
    "Next 5 days": "Siku 5 zijazo",
    "Tap to change place": "Gusa kubadilisha mahali",
    "fiveDays.footnote": "Data ya utabiri inatolewa na huduma yako ya kitaifa ya hali ya hewa.",
    "forecast.lastUpdated": "Utabiri ulisasishwa mara ya mwisho saa {{time}}",
    "welcome.subtitle": "Utabiri wa hali ya hewa na tahadhari, kwa maneno rahisi.",
    "welcome.getStarted": "Anza",
    "welcome.next": "Endelea",
    "warnings.empty.title": "Hakuna tahadhari kwa sasa",
    "warnings.empty.text": "Hakuna tahadhari za hali ya hewa zinazoendelea kwa sasa.",
    "warnings.group.yourArea": "Eneo lako",
    "warnings.group.elsewhere": "Sehemu nyingine nchini",
    "places.pickerTitle": "Chagua maeneo unayoyapenda",
    "places.pickerSubtitle": "Tafuta na uchague hadi maeneo 5 unayojali.",
    "places.selectedCount": "{{count}}/5 zimechaguliwa",
    "places.maxReached": "Umechagua idadi kamili ya maeneo 5.",
    "places.finish": "Maliza",
    "places.removeChip": "Ondoa {{name}}",
    "places.empty.title": "Hakuna maeneo uliyoyapenda bado",
    "places.empty.text": "Ongeza hadi maeneo 5 kuona utabiri wao hapa.",
    "places.setFavourites": "Weka maeneo uyapendayo",
    "places.edit": "Hariri maeneo uliyoyapenda",
    "places.yourPlaces": "Maeneo yako",
    "today.tomorrow": "Kesho",
    "today.warmer": "joto zaidi",
    "today.cooler": "baridi zaidi",
    "today.tapToSeeFiveDays": "Gusa kuona siku 5 zijazo",
    "today.hourByHour": "Leo, saa kwa saa",
    "today.tapToSeeHourly": "Gusa kuona utabiri wa saa kwa saa",
    "day.conditionWindy": "{{condition}} na upepo mkali sana.",
    "Min": "Chini",
    "Max": "Juu",
    "Km/h": "Km/h",
    "Rain": "Mvua",
    "mm": "mm",
    "Wind": "Upepo",
    "Time": "Muda",
    "Temp": "Joto",
    "Department of Climate Change and Meteorological Services (DCCMS)": "Idara ya Mabadiliko ya Tabianchi na Huduma za Hali ya Hewa (DCCMS)",
    "how.we.started": "Jinsi tulivyoanza",
    "how.we.started.desc": "Tulianza na kujitolea na wapenzi wa hali ya hewa miaka ya 1890. Baadaye miaka ya 1940, tulianza kutoa huduma za hali ya hewa kwa usafiri wa anga wa ndani. Leo, tunatoa huduma za kuaminika za hali ya hewa duniani kote. Tunahudumia usafiri wa anga, bahari, kilimo, ufugaji, na zaidi.",
    "our.mandate": "Wajibu wetu",
    "our.mandate.desc": "Kufuatilia, kutabiri na kutoa taarifa kuhusu hali ya hewa na tabianchi, zinazochangia maendeleo ya kijamii na kiuchumi ya nchi.",
    "our.mission": "Dhamira yetu",
    "our.mission.desc": "Kutoa huduma za kuaminika, za haraka na bora za hali ya hewa na tabianchi ili kutimiza wajibu wa kitaifa, kikanda na kimataifa kupitia usambazaji wa wakati wa taarifa sahihi na za kisasa kwa ajili ya maendeleo ya kijamii na kiuchumi.",
    "our.vision": "Dira yetu",
    "our.vision.desc": "Taifa Linaloweza Kukabiliana na Athari za Hali ya Hewa na Tabianchi",
    "app.and.forecasts": "Programu na utabiri wake",
    "app.and.forecasts.desc": "Uundaji wa programu unaongozwa na \nWMO-RAF - Ofisi ya Kanda ya Shirika la Hali ya Hewa Duniani kwa Afrika, na Norway MET - Meteorologisk institutt.\n\n Utabiri wote unatolewa na Norway MET.",
    "Icons": "Ikoni",
    "partners": "Washirika wa mradi huu ni pamoja na",
    "icons.disclaimer": "Ikoni za hali ya hewa zimeidhinishwa na",
    "warning.icons.disclaimer": "Ikoni za tahadhari zimechangiwa na Shirika la Hali ya Hewa Duniani.",
    "Geographical Data": "Data ya Kijiografia",
    "geographical.data.disclaimer": "Data ya kijiografia katika programu hii ilipakuliwa kutoka",
    "Language": "Lugha",
    "English": "Kiingereza",
    "Not available": "Haipatikani",
    "clearsky_day": "Anga safi mchana",
    "clearsky_night": "Anga safi usiku",
    "clearsky_polartwilight": "Anga safi wakati wa giza la nusu la ncha ya dunia",
    "cloudy": "Mawingu",
    "fair_day": "Hali njema mchana",
    "fair_night": "Hali njema usiku",
    "fair_polartwilight": "Hali njema wakati wa giza la nusu la ncha ya dunia",
    "fog": "Ukungu",
    "heavyrainandthunder": "Mvua kubwa na radi",
    "heavyrain": "Mvua kubwa",
    "heavyrainshowersandthunder_day": "Manyunyu makubwa ya mvua na radi mchana",
    "heavyrainshowersandthunder_night": "Manyunyu makubwa ya mvua na radi usiku",
    "heavyrainshowersandthunder_polartwilight": "Manyunyu makubwa ya mvua na radi wakati wa giza la nusu la ncha ya dunia",
    "heavyrainshowers_day": "Manyunyu makubwa ya mvua mchana",
    "heavyrainshowers_night": "Manyunyu makubwa ya mvua usiku",
    "heavyrainshowers_polartwilight": "Manyunyu makubwa ya mvua wakati wa giza la nusu la ncha ya dunia",
    "heavysleetandthunder": "Mvua kubwa ya mchanganyiko na radi",
    "heavysleet": "Mvua kubwa ya mchanganyiko",
    "heavysleetshowersandthunder_day": "Manyunyu makubwa ya mvua ya mchanganyiko na radi mchana",
    "heavysleetshowersandthunder_night": "Manyunyu makubwa ya mvua ya mchanganyiko na radi usiku",
    "heavysleetshowersandthunder_polartwilight": "Manyunyu makubwa ya mvua ya mchanganyiko na radi wakati wa giza la nusu la ncha ya dunia",
    "heavysleetshowers_day": "Manyunyu makubwa ya mvua ya mchanganyiko mchana",
    "heavysleetshowers_night": "Manyunyu makubwa ya mvua ya mchanganyiko usiku",
    "heavysleetshowers_polartwilight": "Manyunyu makubwa ya mvua ya mchanganyiko wakati wa giza la nusu la ncha ya dunia",
    "heavysnowandthunder": "Theluji kubwa na radi",
    "heavysnow": "Theluji kubwa",
    "heavysnowshowersandthunder_day": "Manyunyu makubwa ya theluji na radi mchana",
    "heavysnowshowersandthunder_night": "Manyunyu makubwa ya theluji na radi usiku",
    "heavysnowshowersandthunder_polartwilight": "Manyunyu makubwa ya theluji na radi wakati wa giza la nusu la ncha ya dunia",
    "heavysnowshowers_day": "Manyunyu makubwa ya theluji mchana",
    "heavysnowshowers_night": "Manyunyu makubwa ya theluji usiku",
    "heavysnowshowers_polartwilight": "Manyunyu makubwa ya theluji wakati wa giza la nusu la ncha ya dunia",
    "lightrainandthunder": "Mvua kidogo na radi",
    "lightrain": "Mvua kidogo",
    "lightrainshowersandthunder_day": "Manyunyu kidogo ya mvua na radi mchana",